性質,主管機關,辦理單位,連絡電話,傳真,電子郵件,地址,相關網站,X坐標,Y坐標,備註,最後更新時間
公設民營,臺東縣政府,臺東縣長青活動中心,(089)328423,,,臺東縣臺東市博愛路421號,,264813.9,2516914.25,,20170911
公設民營,臺東縣政府,賓朗老人文康中心,935269167,,,臺東縣卑南鄉賓朗村賓朗路474巷3之1號,,259534.06,2523071.98,,20170911
公設民營,臺東縣政府,卑南老人暨多功能活動中心,(089)571703,,,臺東縣卑南鄉初鹿村忠孝路165號,,259494.35,2528855.14,,20170911
公設民營,臺東縣政府,鹿野老人文康活動中心,937391043,,,臺東縣鹿野鄉瑞和村瑞景路3段195號,,265823.51,2542292.21,,20170911
公設民營,臺東縣政府,關山鎮老人文康中心,(089)812181,,,臺東縣關山鎮豐泉里忠孝路18巷2號,,266656.26,2550033.74,,20170911
公設民營,臺東縣政府,成功鎮老人會館,(089)853317,,,臺東縣成功鎮忠仁里民富路45號,,289305.23,2555494.04,,20170911
